Title,Description,Links,Publication Date
Москвичам старше 65 лет отменили льготное посещение театров и музеев,"В Москве для граждан старше 65 лет отменено льготное посещение учреждений культуры, подведомственных департаменту культуры. Ограничения продлятся до улучшения ситуации с коронавирусом. Распоряжение департамента культуры Москвы опубликовано на сайте столичной мэрии. Согласно документу, учреждениям культуры рекомендовано временно приостановить льготное и бесплатное предоставление услуг лицам старше 65 лет.Мэр Москвы Сергей Собянин 21 января отменил обязательную удаленку для колледжей и разрешил работу детских развлекательных центров, спортивных школ и учреждений культуры. При этом режим домашней изоляции для людей старше 65 лет и граждан с хроническими заболеваниями сохраняется.Подробности смягчения ограничений — в материале “Ъ” «Сергей Собянин открывает музеи и детские комнаты».",https://www.kommersant.ru/doc/4654892,"Thu, 21 Jan 2021 19:43:00 +0300"
Фильм о «дворце Путина» назвали самым быстронабирающим просмотры видео в русскоязычном YouTube,"Количество просмотров фильма Алексея Навального «Дворец для Путина. История самой большой взятки», опубликованного на YouTube 19 января, по данным на 19:30 21 января превысило 45,3 млн просмотров.«Данное видео побило рекорд русскоязычного YouTube по количеству просмотров за первые 48 часов после публикации»,— заявили “Ъ” в крупной международной медиасети по работе с инфлюенсерами. «Это самое быстронабирающее просмотры видео за последние несколько лет, даже на фоне шумих вокруг эстрады, Тимати и Моргенштерна»,— говорит топ-менеджер одной из крупнейших рекламных групп.Представитель платформы Bloggerbase, которая отслеживает топовые видео по динамике просмотров в русскоязычном и англоязычном сегментах, отметил, что с момента публикации видео удерживается на первой позиции как в русскоязычном, так и в англоязычном сегментах, 19 января количество просмотров составляло 12,8 млн, 20 января — 22,4 млн, 21 января на 15:35 — 7,8 млн. «Можно утверждать, что 20 января динамика количества просмотров достигла своего…",https://www.kommersant.ru/doc/4654869,"Thu, 21 Jan 2021 19:35:00 +0300"
Прокуратура Москвы вынесла предупреждения пяти интернет-сервисам о призывах к участию в акциях,"Прокуратура Москвы предостерегла пять интернет-сервисов от распространения призывов к участию в несанкционированных акциях, сообщает пресс-служба ведомства. В ходе мониторинга социальных сетей прокурорами выявлены публикации, «содержащие информацию с призывами к участию граждан, в том числе несовершеннолетних, в массовых беспорядках, а также массовых публичных мероприятиях, проводимых с нарушением установленного порядка на территории Российской Федерации, 23 января 2021 года». О каких сервисах идет речь, не уточняется. По данным источника «Интерфакса», предостережения получили TikTok, «ВКонтакте», Facebook, Twitter, Instagram и YouTube. «Эти компании, а точнее,  их сервисы обязаны заблокировать все публикации с призывами провести 23 января акцию в поддержку Навального»,— сказал собеседник агентства.Ранее Генпрокуратура России потребовала ограничивать доступ к ресурсам, которые призывают выйти на несанкционированные мероприятия 23 января. На этот день во многих городах России запланированы акции в поддержку…",https://www.kommersant.ru/doc/4654875,"Thu, 21 Jan 2021 19:15:00 +0300"
К 2030 году все работники поставщиков Unilever будут получать не меньше прожиточного минимума,"Британско-нидерландская компания Unilever пообещала добиться того, чтобы к 2030 году все работники в сети ее поставок получали заработную плату на уровне не ниже прожиточного минимума. У Unilever около 60 тыс. поставщиков по всему миру, и на эти компании работают несколько миллионов человек, многие из них в бедных и развивающихся странах. Компания намерена потребовать от поставщиков платить сотрудникам зарплату, которая «позволит им в полной мере участвовать в жизни их сообществ и вырваться из порочного круга бедности».Уровень заработной платы, обеспечивающей прожиточный минимум, для каждой страны, где у Unilever есть поставщики, компания рассчитает в сотрудничестве с Fair Wage Network. Как отмечается в заявлении Unilever, с такой зарплатой «работники смогут позволить себе достойный уровень жизни, при котором будут учтены все базовые потребности их семьи».Одновременно с этими обязательствами Unilever в рамках программы поддержки строительства более справедливого общества с равными возможностями для всех…",https://www.kommersant.ru/doc/4654842,"Thu, 21 Jan 2021 19:09:00 +0300"
В Татарстане возбудили дело о призывах к беспорядкам,"В Татарстане следственное управление СКР возбудило уголовное дело по ч. 3 ст. 212 УК РФ (призывы к массовым беспорядкам). Как сообщило ведомство, 20 января «неустановленное лицо разместило в одной из социальных сетей информацию с призывами к совершению массовых беспорядков 23 января 2021 года».По данным СКР, «злоумышленник снабдил сообщение соответствующими инструкциями по антиобщественному поведению». Следователи пытаются установить личность того, кто разместил эту информацию. «Расследование уголовного дела продолжается»,— говорится в сообщении.Напомним, 23 января акции в поддержку Алексея Навального запланированы в нескольких десятках городов России, в том числе в Казани. Местные сторонники оппозиционера уже получили предупреждения МВД по Татарстану о недопустимости нарушения федерального закона о митингах.Господин Навальный был задержан 17 января на паспортном контроле в Шереметьево, куда он прилетел из Берлина, пройдя курс реабилитации после предполагаемого отравления. 18 января его заключили под…",https://www.kommersant.ru/doc/4654870,"Thu, 21 Jan 2021 19:02:00 +0300"
Пробки в Москве достигли 10 баллов,"Пробки в Москве достигли максимального показателя в 10 баллов, свидетельствуют данные сервиса «Яндекс. Карты». Движение, в частности, серьезно осложнено на МКАД, ТТК и Садовом кольце. Наиболее свободный трафик наблюдается на юго-востоке города.По прогнозам сервиса, к 20:00 ожидается снижение автомобильного потока до 8 баллов, к 21:00 — до 6 баллов. Дороги будут свободны после 23:00.В Центре организации дорожного движения пояснили, что причиной заторов на дорогах стал снегопад. «Максимальная нагрузка продержалась 27 минут. Сейчас уже 9 баллов. Основные проблемы в центре.  Сейчас рекомендуем воздержаться от поездок, а если они срочные, то пользоваться метро, МЦД и МЦК. После 21:00 станет полегче»,— сообщили в ЦОДД. На 20:03 «Яндекс. Карты» оценивают загруженность столичных дорог в 8 баллов.",https://www.kommersant.ru/doc/4654873,"Thu, 21 Jan 2021 18:57:00 +0300"
Пресс-служба Пригожина отрицает его причастность к отравлениям в школах Красноармейска,"Пресс-служба компании «Конкорд», которая принадлежит Евгению Пригожину, заявила, что ООО «Продфутсервис», упоминающееся в связи с массовым отравлением в школах подмосковного Красноармейска, никак не связано с этой группой компаний.«Эта фирма ни к Евгению Викторовичу (Пригожину.— “Ъ”), ни к компании ""Конкорд"" никакого отношения не имеет. Приведенные в СМИ данные о связях компании ""Конкорд"" с вышеуказанной организацией являются вымышленными»,— говорится в сообщении пресс-службы.О массовом отравлении школьников в подмосковном Красноармейске стало известно 20 января. К врачам с симптомами отравления обратилось около сотни человек. Прокуратура начала проверку, а СКР возбудил уголовное дело.",https://www.kommersant.ru/doc/4654860,"Thu, 21 Jan 2021 18:52:00 +0300"
СКР возбудил дело о халатности должностных лиц иркутской исправительной колонии,"Иркутское управление СКР возбудило уголовные дела по факту совершения противоправных действий в отношении осужденного в исправительной колонии №6, а также о халатности должностных лиц, из-за которой здоровью осужденного нанесли тяжкий вред.«Следственными органами Следственного управления СК России по Иркутской области возбуждены уголовные дела по факту совершения противоправных действий в отношении 31-летнего осужденного, отбывающего наказание в ФКУ ""Исправительная колония №6 Главного управления Федеральной службы исполнения наказаний по Иркутской области"", а также по факту халатности должностных лиц исправительной колонии, вследствие которой осужденному причинен тяжкий вред здоровью»,— сообщается на сайте СКР.Ранее ФСИН сообщила, что на время служебной проверки от исполнения своих обязанностей отстранено руководство СИЗО-1 Иркутска и ИК-6. Сообщалось, что сотрудниками ведомства выявлен факт незаконных действий отдельных сотрудников ИК-6 и возможных противоправных деяний сексуального характера со стороны…",https://www.kommersant.ru/doc/4654862,"Thu, 21 Jan 2021 18:46:00 +0300"
Европарламент потребовал остановить «Северный поток-2» из-за ареста Навального,"Депутаты Европарламента приняли сегодня, 21 января, резолюцию по России в связи с ситуацией с задержанием оппозиционера Алексея Навального. За резолюцию проголосовал 581 человек, против — всего 50, 44 воздержались. Всего участие в голосовании принял 675 из 705 депутатов Европарламента.В резолюции, финальная версия которой была подготовлена на текущей неделе, депутаты призвали немедленно отпустить господина Навального и других задержанных в день его прилета в РФ, «значительно усилить» ограничительные меры ЕС в отношении России, ввести персональные санкции против «связанных с режимом» российских олигархов и «немедленно остановить» завершение реализации проекта «Северный поток-2».Сегодня, 21 января, документ был принят без обсуждений: соответствующая дискуссия прошла в зале пленарных заседаний еще во вторник, 19 января. Тогда евродепутаты практически единодушно осудили действия российских властей и призвали Брюссель принять жесткие меры в отношении России. Официальный представитель МИД РФ Мария Захарова ранее…",https://www.kommersant.ru/doc/4654823,"Thu, 21 Jan 2021 18:34:00 +0300"
Bloomberg: Apple выпустит гарнитуру виртуальной реальности в 2022 году,"Американская корпорация Apple разрабатывает свой первый шлем виртуальной реальности (VR) и планирует выпустить ее в 2022 году. Об этом сообщает Bloomberg со ссылкой на источники внутри компании.VR-гарнитура под кодовым названием N301 будет способна воспроизводить 3D-среду для игр, просмотра видео или общения. Apple ожидает, что VR-шлем станет нишевым продуктом с очень высокой стоимостью. На рынке Apple будет соревноваться с другими VR-устройствами: Oculus от Facebook, PlayStation VR от Sony, а также со шлемами от HTC. Однако устройство от Apple, по данным источников Bloomberg, будет использовать мощные процессоры, способные выдавать картинку с куда большим разрешением, чем у существующих VR-гарнитур. Некоторые из тестируемых чипов превосходили Apple M1, использующийся во флагманских моделях Mac. Также в шлем от Apple будет встроен вентилятор.По данным издания, при разработке устройства компания столкнулась с многочисленными трудностями и не ожидает от него больших продаж (Bloomberg подсчитал, что Apple…",https://www.kommersant.ru/doc/4654820,"Thu, 21 Jan 2021 18:23:00 +0300"
Трубоукладчик «Северного потока-2» направился в Германию,"Трубоукладчик «Академик Черский», способный достроить газопровод «Северный поток-2», вышел из порта Калининграда и направился в немецкий порт Висмар, свидетельствуют данные сервиса Myshiptracking.Кроме того, трубоукладчик «Фортуна», которым планировалось достраивать газопровод, покинул немецкий порт Росток, свидетельствуют данные Marine Traffic. США ввели санкции в отношении трубоукладчика «Фортуна» и его владельца ООО «КВТ-Рус» 19 января.Ранее «Газпром» предупредил о возможной приостановке проекта, но заявил о намерении его достроить, вопреки давлению. Кремль назвал санкции незаконными. Администрация президента США Джо Байдена заявила, что будет добиваться остановки проекта. Министерство экономики и энергетики ФРГ заявило, что с сожалением восприняло решение США расширить санкции в отношении «Северного потока-2». Канцлер ФРГ Ангела Меркель считает «неуместным средством» экстерриториальные санкции США в отношении проекта.О том, стоит ли ожидать прекращения строительства газопровода,— в материале “Ъ…",https://www.kommersant.ru/doc/4654847,"Thu, 21 Jan 2021 18:05:00 +0300"
«Спартак» и «Фиорентина» договорились о трансфере Кокорина,"Нападающий «Спартака» Александр Кокорин в ближайшее время перейдет в итальянский футбольный клуб «Фиорентина». Об этом сначала сообщил сам Кокорин «Матч ТВ», а затем подтвердил и «Спартак». Контракт будет подписан после медосмотра, который пройдет в Италии. По данным СМИ, сумма трансфера может составить €5 млн.«Да, я практически игрок ""Фиорентины"". Осталось пройти какие-то моменты, самое главное — медицинский осмотр. И потом подписать контракт»,— сказал Кокорин. Агент футболиста Тимофей Бердышев сообщил, что подписание контракта состоится во вторник, 26 января.«В самое ближайшее время форвард отправится в Италию на медицинское обследование и в случае успешного прохождения подпишет с ''фиалками'' контракт на три с половиной года. Желаем Александру успешно проявить себя в одной из ведущих футбольных лиг Европы»,— говорится в сообщении на сайте «Спартака».29-летний Александр Кокорин выступает за «Спартак» с августа 2020 года. В десяти матчах за московский клуб забил два гола. Ранее в составе «Зенита»…",https://www.kommersant.ru/doc/4654829,"Thu, 21 Jan 2021 17:48:00 +0300"
Соболь задержана за призывы к участию в митингах,"Полиция задержала юриста Фонда борьбы с коррупцией (ФБК, внесен Минюстом в реестр иностранных агентов) Любовь Соболь за призывы участвовать в не санкционированном властями митинге 23 января с требованием освободить оппозиционера Алексея Навального из-под ареста. Об этом сообщил “Ъ” ее адвокат Владимир Воронин.В своем Twitter господин Воронин сообщал, что госпожу Соболь, прежде чем задержать, вытащили из его машины.Политика отвезли в ОВД «Донской». Позже Владимир Воронин рассказал “Ъ”, что он приехал туда, но его отказываются пропускать в отдел.Ранее Любовь Соболь вместе с адвокатом побывала в Главном управлении Следственного комитета по вызову следователя в рамках возбужденного против нее уголовного дела. Госпожу Соболь обвиняют в незаконном проникновении в жилище с применением насилия (ч. 2 ст. 139 УК РФ). Напомним, 21 декабря юрист ФБК приехала по адресу проживания Константина Кудрявцева, который, по данным совместного расследования ФБК, Bellingcat, The Insider, CNN и Der Spiegel, работает в одном…",https://www.kommersant.ru/doc/4654838,"Thu, 21 Jan 2021 17:35:00 +0300"
