Title,Description,Links,Publication Date
Россия готова незамедлительно начать с США переговоры по продлению СНВ-3,"Москва готова как можно быстрее вступить в контакт с Вашингтоном относительно продления Договора о мерах по дальнейшему сокращению и ограничению стратегических наступательных вооружений (ДСНВ, СНВ-3), сообщила официальный представитель МИД РФ Мария Захарова. Ранее США выступили за продление соглашения.«Обратили внимание на заявление пресс-секретаря Белого дома в пользу продления действия Договора о СНВ на пять лет. Подобный настрой можем только приветствовать. Готовы, не откладывая, вступить в контакт по линии внешнеполитических ведомств России и США для скорейшего оформления договоренности о продлении договора»,— сказала госпожа Захарова.Представитель МИД РФ добавила, что согласовать продление документа необходимо в сжатые сроки, так как его действие истекает 5 февраля. «Россия последовательно выступала и выступает за принятие такого решения»,— напомнила она.На продлении ключевого российско-американского договора на максимальный срок — пять лет — настаивала Москва. Эти условия не устраивали администрацию…",https://www.kommersant.ru/doc/4660516,"Fri, 22 Jan 2021 16:51:00 +0300"
В Тюмени задержан координатор штаба Навального,"В Тюмени полиция составила протокол об административном правонарушении в отношении координатора местного штаба Алексея Навального Ивана Вострикова. Как сообщается в Telegram-канале штаба, его обвиняют в призыве на несанкционированную протестную акцию 23 января (ст. 20.2.2 КоАП РФ). В штабе пояснили, что Иван Востриков был задержан сегодня, 22 января, сотрудниками в штатском. Сейчас он находится в отделении полиции №5, где останется до суда, который состоится 23 января.Задержания и аресты сторонников Алексея Навального сегодня проходят во многих городах. Так, по обвинению в несанкционированной организации публичного мероприятия была арестована координатор штаба Алексея Навального во Владивостоке Екатерина Ведерникова. В Уфе были  задержаны юрист местного штаба Алексея Навального Федор Телин и волонтер Ольга Комлева. В Волгограде задержан координатор местного штаба Евгений Кочегин. В Москве за призывы участвовать в не санкционированном властями митинге 23 января на девять суток арестована пресс-секретарь оппозиционера…",https://www.kommersant.ru/doc/4660477,"Fri, 22 Jan 2021 16:36:00 +0300"
«ВКонтакте» заблокировал встречи сторонников Навального накануне дня протестов,"Социальная сеть «ВКонтакте» по требованию Генпрокуратуры заблокировала страницы встреч «Свободу Навальному!» с призывами к протестам 23 января. Недоступны встречи, которые объявили региональные штабы политика Алексея Навального в Москве, Санкт-Петербурге, Нижнем Новгороде и других городах.«Данный материал заблокирован на территории РФ на основании требования Генеральной прокуратуры Российской Федерации от 20.01.2021 № 27-31-2021/Ид430-21»,— указано в сообщении на месте страницы о встрече в Москве. Тот же номер требования указан и в сообщениях о блокировках других встреч. «Медиазона» отмечает, что «ВКонтакте» заблокировал 63 страницы из 66, указанных на сайте Алексея Навального. На странице встречи в городе Ялуторовск Тюменской области появилось сообщение, что «митинг не состоится», а те, кто выйдут на него, нарушат «2е не зависимых статьи» (орфография сохранена).Ранее Роскомнадзор сообщал, что «ВКонтакте» наряду с YouTube удалил 50% публикаций о призывах к несанкционированным акциям. При этом ведомство…",https://www.kommersant.ru/doc/4660483,"Fri, 22 Jan 2021 16:27:00 +0300"
"Арестован глава «Водоканала» Буйнакска, где произошла вспышка острой кишечной инфекции","Исполняющий обязанности директора муниципального унитарного предприятия «Буйнакскводоканал» Абдулвагаб Шарипов арестован на два месяца по решению суда. В минувшую среду ему было предъявлено обвинение в совершении преступления, предусмотренного п. «б» ч. 2 ст. 238 (выполнение работ и оказание услуг, не отвечающих требованиям безопасности жизни или здоровья потребителей, совершенные в отношении товаров, работ или услуг, предназначенных для детей в возрасте до 6 лет) УК РФ. В результате его действий, считают следователи, с 9 по 18 января в медицинские учреждения Буйнакска с симптомами отравления обратились более 300 человек, в том числе 246 детей, у которых выявлена острая кишечная инфекция (ОКИ). Причиной ОКИ стал прием питьевой воды из общего водопровода.Как сообщал “Ъ”, Абдулвагаб Шарипов был задержан 18 января. 22 января Советский районный суд Махачкалы по ходатайству следствия избрал в отношении господина Шарипова меру пресечения в виде заключения под стражу сроком на два месяца, до 18 марта. Как сообщили…",https://www.kommersant.ru/doc/4660446,"Fri, 22 Jan 2021 16:12:00 +0300"
Доллар впервые с 5 января превысил 75 рублей,"Курс доллара вырос на 1,18% и составляет 75,04 руб., следует из данных торгов Московской биржи. Курс евро составляет 91,26 руб. (+1,42%). Индекс Мосбиржи упал на 1,5%, до 3371,31 п., индекс РТС — до 1417,00 п. (–3,2%). Нефть марки Brent торгуется на уровне $54,7 за баррель (–2,4%), стоимость нефти марки WTI опустилась до $51,71 за баррель (–1,4%).",https://www.kommersant.ru/doc/4660490,"Fri, 22 Jan 2021 16:09:00 +0300"
МИД РФ: США нужны Киеву в «нормандском формате» для отказа от минских договоренностей,"В стремлении Украины расширить число участников «нормандского формата», включив в него США и Великобританию, российский МИД видит желание усилить давление на Россию. Кроме того, в дипведомстве подозревают желание сорвать выполнение минских договоренностей.«Подключение США (а нередко в этом контексте упоминается еще и Великобритания), по замыслу Киева, позволило бы усилить давление на Россию, которую пытаются выставить ""агрессором и оккупантом"", в интересах урегулирования конфликта по киевским лекалам, то есть в отход от положений минского комплекса мер, который закреплен резолюцией 2202 СБ ООН»,— заявили ТАСС в МИД РФ.«Расширение круга участников переговорного процесса возможно только на основе консенсуса, о наличии которого на сегодняшний день говорить не приходится»,— добавили в российском дипведомстве.Переговоры советников «нормандской четверки» состоялись в Берлине 12 января. По словам главы российской делегации Дмитрия Козака, они ни к чему не привели. Уполномоченный Верховной рады Украины по…",https://www.kommersant.ru/doc/4660487,"Fri, 22 Jan 2021 16:08:00 +0300"
Задержаны глава и сотрудница штаба Навального в Ростове-на-Дону,"Глава ростовского штаба Алексея Навального Ксения Середкина и сотрудница штаба Валерия Дзбоева задержаны накануне шествия в поддержку политика. Момент задержания транслировался в прямом эфире на странице штаба в Instagram, трансляция оборвалась и не была сохранена. В ходе эфира Ксения Середкина просила стоящих в коридоре квартиры людей в гражданском представиться, на что они ответили, что представлялись ранее. Затем глава штаба попросила дать ей одеться и обещала после этого проследовать с пришедшими к ней людьми. Кадры трансляции начали быстро сменяться, при этом госпожа Середкина начала повторять: «Что вы творите?» и «Мы же никуда не денемся отсюда». На этом эфир оборвался. На звонок по телефону госпожа Середкина не ответила.Ранее сотрудники штаба объявили о проведении в Ростове-на-Дону в субботу, 23 января, шествия в поддержку оппозиционера Алексея Навального. Глава сети региональных штабов Алексея Навального Леонид Волков объявил, что в ответ на арест политика штабы начинают подготовку к митингам по…",https://www.kommersant.ru/doc/4660444,"Fri, 22 Jan 2021 15:48:00 +0300"
Путин обсудил с Совбезом контроль над вооружениями и стратегическую стабильность,"Президент России Владимир Путин обсудил на совещании с постоянными членами Совета безопасности (СБ) РФ вопросы стратегической стабильности, а также внутрироссийские проблемы, сообщил журналистам пресс-секретарь главы государства Дмитрий Песков.«На совещании обсуждались текущие вопросы социально-экономического развития России. Состоялся также обмен мнениями по вопросам стратегической стабильности и контроля над вооружениями»,— сказал господин Песков (цитата по «Интерфаксу»). В совещании участвовали премьер-министр Михаил Мишустин, спикер Совета федерации Валентина Матвиенко и спикер Госдумы Вячеслав Володин, зампредседателя СБ Дмитрий Медведев, секретарь СБ Николай Патрушев, глава МИДа Сергей Лавров и министр внутренних дел Владимир Колокольцев. Кроме того, присутствовали директор ФСБ Александр Бортников, глава СВР Сергей Нарышкин и спецпредставитель президента по вопросам природоохранной деятельности, экологии и транспорта Сергей Иванов.Ранее газета The Washington Post сообщала, что администрация 46-го…",https://www.kommersant.ru/doc/4660469,"Fri, 22 Jan 2021 15:39:00 +0300"
Зинедин Зидан заразился коронавирусом,"У 48-летнего тренера мадридского «Реала» Зинедина Зидана обнаружен коронавирус, сообщил клуб. «У нашего тренера Зинедина Зидана положительный результат на COVID-19»,— говорится в сообщении клуба. Подробности не приводятся.Ближайший матч «Реала» запланирован на завтра, 23 января. Команда сыграет против «Алавеса» в рамках чемпионата Испании.",https://www.kommersant.ru/doc/4660457,"Fri, 22 Jan 2021 15:25:00 +0300"
Координатора краснодарского штаба Навального арестовали на 10 суток,"Ленинский суд Краснодара признал Анастасию Панченко, координатора местного штаба Навального, виновной в организации несанкционированного массового мероприятия (ст. 20.2 КоАП РФ) и определил ей наказание в виде десяти суток административного ареста, сообщил “Ъ” адвокат Михаил Беньяш.Анастасия Панченко, задержанная вчера в Краснодаре, не признала вину. Как следует из копии протокола, опубликованной адвокатом Михаилом Беньяшем в социальной сети Facebook, сотрудники МВД при мониторинге сети Интернет выявили факт нарушения законодательства о порядке проведения массовых мероприятий: по данным полиции, Анастасия Панченко опубликовала в сети информацию с призывом к «участию в несогласованном публичном мероприятии в поддержку российского оппозиционера Навального», говорится в протоколе. Анастасия Панченко заявила в суде, что информация об акции, размещенная на страницах штаба в соцсетях, не является призывом участвовать в несанкционированном мероприятии.Ранее сегодня по обвинению в несанкционированной организации…",https://www.kommersant.ru/doc/4660426,"Fri, 22 Jan 2021 15:19:00 +0300"
Чемпионат мира по хоккею может пройти в Словакии,"Международная федерация хоккея (IIHF) ведет со Словацким союзом хоккея на льду переговоры о проведении в Братиславе чемпионата мира в 2021 году. Ранее было отменено решение проводить его в Белоруссии.«Международная федерация хоккея и Словацкий союз хоккея на льду начали переговоры о проведении в Братиславе матчей одной из групп чемпионата мира, которые ранее планировалось провести в Минске. Идет подготовка документации и рассмотрение бюджета, но пока еще ничего точно не определено. Окончательное решение должен принять совет IIHF»,— сказал представитель союза Петер Яношик (цитата по «РИА Новости»). Чемпионат мира по хоккею должен был пройти с 21 мая по 6 июня в Риге и Минске, но из-за реакции белорусских властей на протесты в стране основные спонсоры ЧМ Nivea Men, Skoda и Liqui Moly отказались поддерживать соревнование, если его матчи пройдут там.Подробнее — в материале “Ъ” «У Александра Лукашенко выбили клюшку из рук».",https://www.kommersant.ru/doc/4660450,"Fri, 22 Jan 2021 15:15:00 +0300"
Роскомнадзор отчитался об удалении информации о протестах в соцсетях,"Роскомнадзор рассказал, как социальные сети удаляют призывы к участию в несанкционированных акциях. Больше всех публикаций удалили YouTube и «ВКонтакте» — по 50%, TikTok и Instagram удалили 38% и 17% записей. Роскомнадзор направил уведомления соцсетям на фоне призывов об участии в акциях в поддержку оппозиционера Алексея Навального 23 января.Наибольшая активность проявляется в TikTok, утверждает ведомство. «Появляются новые призывы, распространение которых носит в том числе искусственный характер»,— говорится в сообщении Роскомнадзора.Роскомнадзор вчера, 21 января, пригрозил соцсетям штрафами за привлечение подростков на митинги. Речь идет о ст. 13.41 КоАП РФ, вступившей в силу 10 января. Статья подразумевает ответственность за нарушение порядка ограничения доступа к запрещенной информации владельцами интернет-ресурсов. Нарушение грозит штрафом до 4 млн руб. для юрлиц (за повторное — до 10% годовой выручки).Минпросвещения России уже призвало родителей оградить своих детей от участия в митингах 23 января…",https://www.kommersant.ru/doc/4660452,"Fri, 22 Jan 2021 15:06:00 +0300"
"Закрытие школ и дистанционка во время пандемии могут обойтись Германии в €3,3 трлн","Эксперты немецкого Института экономических исследований (Ifo) попробовали подсчитать, какой негативный экономический эффект могут иметь для Германии временное закрытие школ и перевод школьников на дистанционное обучение во время пандемии — негативный эффект связан с ухудшением образования при подобном формате. Как рассказал газете Handelsblatt экономист Ifo Людгер Вессманн, это может привести к «огромному экономическому ущербу как для отдельных школьников, так и для экономики в целом», потому что «ничто в экономике образования не имеет столь основательных подтверждений, как связь между образованием и доходами».В Ifo подсчитали, что 18 недель закрытия школ — 12 недель весной 2020 года и 6 недель сейчас — могут стоить германской экономике €3,3 трлн до конца XXI века. По словам господина Вессманна, если школы останутся закрытыми до конца февраля, что вполне вероятно из-за продолжающегося роста заражений, это может привести к снижению доходов нынешних школьников в течение жизни в среднем на 4,5%. Если же школы…",https://www.kommersant.ru/doc/4660428,"Fri, 22 Jan 2021 14:57:00 +0300"
