Title,Description,Links,Publication Date
Жительница «самого страшного дома Англии» рассказала о полтергейсте,"Ширли Хитчингс, также известная как «жительница самого страшного дома в Англии», впервые за много лет рассказала, как ее семью годами преследовал полтергейст, которого она и ее близкие назвали Дональдом. Дом детства Ширли находится в районе Баттерси (южный Лондон). Она столкнулась с потусторонней силой в 15 лет.",https://lenta.ru/news/2021/01/23/poltergeist/,"Sat, 23 Jan 2021 18:03:00 +0300"
На несанкционированной акции в Москве обнаружили зараженных коронавирусом,"19 зараженных коронавирусом человек были обнаружены на несанкционированной акции в Москве. Об этом сообщает оперативный штаб по контролю и мониторингу распространения инфекции в своем Telegram-канале. Отмечается, что в отношении этих лиц зафиксированы факты нарушения карантина и обязательной самоизоляции.",https://lenta.ru/news/2021/01/23/zarazheny/,"Sat, 23 Jan 2021 17:53:14 +0300"
Участники несанкционированной акции в Москве устроили драки с полицейскими,"Участники несанкционированной акции, которая проходит на Пушкинской площади в центре Москвы, устроили драки с сотрудниками полиции. По данным ТАСС, соратники оппозиционера Алексея Навального начали оказывать сопротивление при попытках сотрудников правоохранительных органов зачистить площадь.",https://lenta.ru/news/2021/01/23/ustroili/,"Sat, 23 Jan 2021 17:36:00 +0300"
Россиянки остались без медалей в масс-старте на этапе Кубка мира по биатлону,"Француженка Жулия Симон стала победительницей масс-старта на этапе Кубка мира по биатлону в итальянском Антхольце. Спортсменка допустила три промаха по ходу дистанции. Второй с одним неточным выстрелом и отставанием в 0,2 секунды стала шведка Ханна Эберг. Тройку лучших замкнула представительница Австрии Лиза Хаузер.",https://lenta.ru/news/2021/01/23/shestoebiathlon/,"Sat, 23 Jan 2021 17:28:00 +0300"
МИД потребовал объяснений от американских дипломатов,"Официальный представитель Министерства иностранных дел (МИД) России Мария Захарова заявила, что представителям посольства США придется объясниться «на Смоленской площади», подразумевая главное здание ведомства. Американских дипломатов обязали объясниться из-за недавней публикации на сайте американской дипмиссии.",https://lenta.ru/news/2021/01/23/objasnitsa/,"Sat, 23 Jan 2021 17:26:00 +0300"
На Украине заявили о задержании «агента ФСБ» по прозвищу Джигурда,"Служба безопасности Украины (СБУ) задержала в Херсонской области мужчину, который якобы является агентом ФСБ России по прозвищу Джигурда. По данным СБУ, он получил от своих кураторов денежное вознаграждение за организацию на Украине протестных мероприятий с целью дестабилизации ситуации в стране.",https://lenta.ru/news/2021/01/23/djigurda/,"Sat, 23 Jan 2021 17:26:00 +0300"
Ученый рассказал о смысле прививаться сразу двумя вакцинами от коронавируса,"Доктор биологических наук Алексей Аграновский рассказал о смысле прививаться сразу двумя вакцинами от коронавируса. «Если человек по каким-то причинам не поставил вторую дозу ""Спутника V"", то он может поставить другую вакцину», — прокомментировал ученый.",https://lenta.ru/news/2021/01/23/corondve/,"Sat, 23 Jan 2021 17:18:00 +0300"
Тысячи бойцов Нацгвардии оставят в Вашингтоне из-за опасности беспорядков,"Пять тысяч бойцов Национальной гвардии останутся в Вашингтоне до середины марта из-за того, что власти опасаются новых беспорядков на фоне ситуации с импичментом и планирующегося обращения президента Джо Байдена Конгрессу. Источник заявил, что войска останутся в Вашингтоне из-за данных разведки о будущих демонстрациях.",https://lenta.ru/news/2021/01/23/lsk/,"Sat, 23 Jan 2021 17:08:00 +0300"
Большунов проиграл вернувшимся на Кубок мира норвежцам,Российский лыжник Александр Большунов занял пятое место в скиатлоне на этапе Кубка мира по лыжным гонкам в финском Лахти. Большунов проиграл вернувшимся к участию в Кубке мира норвежцам. Победителем стал Эмиль Иверсен. Второе место занял Шюр Рете. Третьим стал Пол Гульберг.,https://lenta.ru/news/2021/01/23/bolschunov/,"Sat, 23 Jan 2021 16:32:00 +0300"
Митингующие в Москве скинули противника Навального с фонаря,"Участники несанкционированной акции в Москве скинули противника Алексея Навального с фонаря на Пушкинской площади. По данным издания Baza, мужчина забрался на фонарь, держа плакат «Кесарю — кесарево. (...) Депортировать Навального». Сторонники оппозиционера сняли мужчину и избили.",https://lenta.ru/news/2021/01/23/kesar_poletel/,"Sat, 23 Jan 2021 16:23:00 +0300"
Детский омбудсмен отреагировала на задержание ребенка в центре Москвы,"Уполномоченный по правам ребенка при президенте России Анна Кузнецова отреагировала на видео задержания ребенка в ходе несанкционированной акции в Москве и назвала действия полицейских грубыми. Кузнецова заявила, что подросток уже передан родителям, омбудсмен выясняет детали.",https://lenta.ru/news/2021/01/23/rebenok/,"Sat, 23 Jan 2021 16:15:00 +0300"
В Москве задержали Юлию Навальную,"Юлия Навальная, жена блогера Алексея Навального, задержана в ходе несанкционированной акции в Москве и находится в автозаке. Об этом в субботу, 23 января, сама Навальная сообщила в своем Instagram, опубликовав соответствующее фото. «Извините за плохое качество. Очень плохой свет в автозаке», — подписала фото автор.",https://lenta.ru/news/2021/01/23/avto/,"Sat, 23 Jan 2021 16:11:00 +0300"
Умер телеведущий Ларри Кинг,"Американский телеведущий Ларри Кинг умер в возрасте 87 лет. Его компания Ora Media объявила в социальной сети о его смерти, написав, что ведущий скончался сегодня в медицинском центре Cedars-Sinai в Лос-Анджелесе. Ранее сообщалось, что Кинг был госпитализирован с коронавирусом.",https://lenta.ru/news/2021/01/23/larry/,"Sat, 23 Jan 2021 16:07:00 +0300"
В российском городе столкнулись машина полиции и скорая помощь,"В российском городе столкнулись машина полиции и скорая помощь, это произошло в субботу, 23 января, в Саратове. По данным минздрава области, пациент из скорой скончался, фельдшер пострадала. ДТП произошло в районе полудня на пересечении улиц Кутякова и Астраханской, машина медиков перевернулась.",https://lenta.ru/news/2021/01/23/stolk/,"Sat, 23 Jan 2021 16:00:00 +0300"
Китай разрешил береговой охране открывать огонь по иностранным судам,"Постоянный комитет Всекитайского собрания народных представителей (высший законодательный орган страны) принял закон, позволяющий береговой охране страны открывать огонь по иностранным судам и использовать «все необходимые средства» для остановки или предотвращения угроз с их стороны.",https://lenta.ru/news/2021/01/23/razresheniye/,"Sat, 23 Jan 2021 15:55:00 +0300"
Скончался президент Московского зоопарка,"Президент Московского зоопарка Владимир Спицин скончался на 80-м году жизни. Причины смерти Владимира Спицина не называются. Как отмечается в официальном сообщении, Спицин почти всю жизнь посвятил работе с животными — он устроился в Ленинградский зоопарк в 17 лет, сразу после окончания школы.",https://lenta.ru/news/2021/01/23/spitsyn/,"Sat, 23 Jan 2021 15:36:00 +0300"
После обрушения льда с крыши в российском городе погиб ребенок,"В российском городе с крыши пятиэтажного дома упала глыба льда, в результате погиб ребенок. Это произошло в субботу, 23 января, в Саратове на улице Азина. Сосулька свалилась на голову 11-летнего мальчика, который получил тяжелые травмы и погиб. Сотрудники СК и криминалисты осматривают место происшествия.",https://lenta.ru/news/2021/01/23/upal/,"Sat, 23 Jan 2021 15:30:00 +0300"
Канадский игрок НХЛ осудил устроивших посиделки в отеле российских хоккеистов,"Канадский нападающий клуба Национальной хоккейной лиги (НХЛ) «Бостон Брюинс» Брэд Маршанд осудил нарушивших медицинские протоколы, касающиеся коронавируса, российских хоккеистов «Вашингтон Кэпиталc». Маршанд посчитал, что россияне проявили неуважение к руководству Лиги.",https://lenta.ru/news/2021/01/23/marchand/,"Sat, 23 Jan 2021 15:18:00 +0300"
Полицейских закидали яйцами и бутылками на несанкционированной акции в Москве,"На несанкционированной акции в центре Москвы, которая проходит 23 января, начались потасовки с полицией. Об этом сообщает РИА Новости. Отмечается, что на Пушкинской площади начали кидать пластиковые бутылки и яйца в представителей правоохранительных органов, начались потасовки.",https://lenta.ru/news/2021/01/23/potasovki/,"Sat, 23 Jan 2021 15:15:00 +0300"
На Украине раскрыли происхождение записи разговоров Байдена и Порошенко,"Депутат Верховной Рады Украины Андрей Деркач, опубликовавший аудиозаписи предполагаемых разговоров бывшего президента Украины Петра Порошенко и нынешнего президента США Джо Байдена, занимавшего в прошлом пост вице-президента, раскрыл происхождение записей. Оказалось, что Порошенко сам тайно записывал свои разговоры.",https://lenta.ru/news/2021/01/23/poroshenko_zapisyvaet/,"Sat, 23 Jan 2021 15:11:00 +0300"
Способное достроить «Северный поток-2» судно прибыло в немецкий порт,Способный достроить газопровод «Северный поток-2» трубоукладчик «Академик Черский» прибыл в немецкий порт Висмар. Об этом свидетельствуют данные глобальной системы позиционирования судов Marine Traffic. Другое судно — «Фортуна» —  находится в районе недостроенного участка газопровода.,https://lenta.ru/news/2021/01/23/trub/,"Sat, 23 Jan 2021 15:04:00 +0300"
Правительство не поддержало проект о наказании за вовлечение в акции протеста,"Комиссия правительства по законопроектной деятельности не поддержала предложенный депутатом Госдумы Евгением Марченко законопроект, предусматривающий уголовное наказание за вовлечение несовершеннолетних в несанкционированные акции. Отмечается, что в УК РФ уже сейчас предусмотрена ответственность за данное преступление.",https://lenta.ru/news/2021/01/23/nepodderzhalo/,"Sat, 23 Jan 2021 15:02:00 +0300"
МВД предупредило о расследовании каждой провокации на несанкционированных акциях,"МВД России предупреждает граждан, которые планируют участвовать в несанкционированных публичных мероприятиях, что каждый факт провокаций в отношении сотрудников правоохранительных органов, охраняющих общественный порядок, будет расследован и получит правовую оценку.",https://lenta.ru/news/2021/01/23/mvd/,"Sat, 23 Jan 2021 14:59:00 +0300"
В МВД назвали число участников несанкционированной акции в центре Москвы,"В несанкционированной акции, которая проходит на Пушкинской площади в центре Москвы в субботу, 23 января, принимают участие порядка четырех тысяч человек. Такое число назвали в официальном сообщении, опубликованном на сайте столичного главка МВД. До этого в столице начались задержания.",https://lenta.ru/news/2021/01/23/4tisyachi/,"Sat, 23 Jan 2021 14:50:00 +0300"
Россиянин попытался убить женщину и покончил с собой,"В Нижнем Новгороде россиянин попытался убить женщину в квартире, а после этого покончил с собой. Это произошло утром в субботу, 23 января. «В ходе ссоры 20-летний мужчина произвел не менее 3-х выстрелов из незарегистрированного огнестрельного оружия в женщину, а затем свел счеты с жизнью», — говорится в сообщении СК.",https://lenta.ru/news/2021/01/23/ubit/,"Sat, 23 Jan 2021 14:50:00 +0300"
Полиция раздала маски на несанкционированной акции в Москве,"Сотрудники полиции раздали медицинские маски на несанкционированной акции в центре Москвы. Сообщается, что на Пушкинской площади девушки-полицейские выдают маски всем, кто пришел без них. «Просьба соблюдать меры безопасности против коронавирусной инфекции», —  сказали они.",https://lenta.ru/news/2021/01/23/maskiipechenya/,"Sat, 23 Jan 2021 14:40:55 +0300"
Армия США рассказала о «кровопускании» из-за России,"Армия США на фоне ограниченности финансовых средств, вызванной коронавирусной инфекцией, в текущем году проведет собственное «кровопускание» ради Военно-воздушных сил (ВВС) и Военно-морских сил (ВМС) страны, пишет Breaking Defense, ссылаясь на заявление начальника штаба армии генерала Джеймса МакКонвилла.",https://lenta.ru/news/2021/01/23/bloodletting/,"Sat, 23 Jan 2021 14:37:00 +0300"
Задержанного на несанкционированной акции в Москве блогера Варламова отпустили,Фотографа и блогера Илью Варламова отпустили после задержания на несанкционированной акции в центре Москвы. Это произошло на Пушкинской площади. Варламова отпустили после проверки документов. Ранее о пресечении акций 23 января силовиками сообщила прокуратура.,https://lenta.ru/news/2021/01/23/varlamov/,"Sat, 23 Jan 2021 14:34:00 +0300"
На несанкционированной акции в Москве начались задержания,"На несанкционированной акции, которая проходит на Пушкинской площади в центре Москвы в субботу, 23 января, начались задержания. Правоохранители задерживают тех, кто полностью скрывает свое лицо при помощи масок, шарфов и балаклав, а также протестующих, которые пришли на митинг с плакатами.",https://lenta.ru/news/2021/01/23/zaderjaniya/,"Sat, 23 Jan 2021 14:30:00 +0300"
Кабинет Милонова сгорел при пожаре в московском храме,Кабинет депутата Госдумы Виталия Милонова сгорел при пожаре на территории храма Святителя Петра Митрополита Московского. Утром 22 января огонь охватил отдельно стоящее одноэтажное деревянное строение на территории храма — в нем находились кабинеты духовенства и депутата Милонова.,https://lenta.ru/news/2021/01/23/milonov/,"Sat, 23 Jan 2021 14:29:00 +0300"
Участвующий в ралли автомобиль въехал в толпу зрителей в российском городе,"Участвующий в ралли «Карелия-2021» автомобиль въехал в толпу наблюдающих за гонкой зрителей. На опубликованных в соцсетях кадрах с места происшествия видно, как машину заносит, после чего она переворачивается и слетает с дороги, побуждая бежать прочь всех, кто оказался на ее пути.",https://lenta.ru/news/2021/01/23/rally/,"Sat, 23 Jan 2021 14:26:00 +0300"
Мужчина пригрозил устроить взрыв на несанкционированной акции в Москве,"Мужчина пригрозил устроить взрыв на несанкционированной акции в центре Москвы и был задержан полицией. Об этом в субботу, 23 января, сообщили ТАСС в пресс-службе столичного главка МВД. Там уточнили, что в течение часа личность звонившего была установлена — им оказался мужчина 1984 года рождения.",https://lenta.ru/news/2021/01/23/vzriv/,"Sat, 23 Jan 2021 14:08:00 +0300"
Адмирал ответил на версию о неспособности России построить авианосец,"Отсутствие строительства новых авианосцев в России связано с тем, что в этом нет необходимости, а не с тем, что страна неспособна создать такие корабли. Так адмирал Игорь Касатонов прокомментировал статью американского журнала Forbes о постсоветском коллапсе в кораблестроении.",https://lenta.ru/news/2021/01/23/avianos/,"Sat, 23 Jan 2021 14:07:00 +0300"
Плющенко рассказал о переезде в Петербург и жизни в коммуналке,"Двукратный олимпийский чемпион по фигурному катанию Евгений Плющенко рассказал об условиях жизни в начале спортивной карьеры. Плющенко вспомнил, как в Волгограде закрылась ледовая арена и он был вынужден переехать в Петербург. Он рассказал, что они с мамой сняли комнату в коммунальной квартире с пятью соседями.",https://lenta.ru/news/2021/01/23/plusch/,"Sat, 23 Jan 2021 14:04:00 +0300"
Операторы сотовой связи опровергли сообщения о сбоях в сетях,"Операторы сотовой связи — Билайн и МТС — опровергли сообщения о сбоях в сетях. В частности, в МТС указали, что сеть сейчас работает в обычном режиме. Там указали, что присутствие большого количества людей в ограниченном пространстве может приводить к снижению скорости мобильного интернета.",https://lenta.ru/news/2021/01/23/operatoru/,"Sat, 23 Jan 2021 13:54:00 +0300"
